subject,topic,text,difficulty
Math,Algebra,"Algebra is a branch of mathematics dealing with symbols and the rules for manipulating those symbols",Easy
Math,Geometry,"Geometry is concerned with properties of space that are related with distance shape size and relative position of figures",Medium
Science,Physics,"Physics is the natural science that studies matter its motion and behavior through space and time",Medium
Science,Chemistry,"Chemistry is the scientific discipline involved with elements and compounds composed of atoms molecules and ions",Hard
History,Ancient,"Ancient history is the aggregate of past events from the beginning of writing and recorded human history",Easy
English,Grammar,"Grammar is the set of structural rules governing the composition of clauses phrases and words",Easy
